id,lat,lon,placeCount,place,address
2,15.781512726846858,103.00219976072401,3,school|establishment|point_of_interest,"Hak Noi-don Kloi Rd, Tambon Nong Mek, Amphoe Na Chueak, Chang Wat Maha Sarakham 44170, Thailand"
3,15.781512726846858,103.0302380872622,34,establishment|point_of_interest|hospital,"ถนนนาเชือก-พยัฆภูมพิสัย Tambon Na Chueak, Amphoe Na Chueak, Chang Wat Maha Sarakham 44170, Thailand"
7,15.781512726846858,103.47885131187331,3,school|establishment|point_of_interest,"Unnamed Road, Tambon Du Noi, Amphoe Chaturaphak Phiman, Chang Wat Roi Et 45180, Thailand"
8,15.781512726846858,103.50688963841151,6,establishment|point_of_interest|hospital,"Unnamed Road, Tambon I Ngong, Amphoe Chaturaphak Phiman, Chang Wat Roi Et 45180, Thailand"
16,15.754533079476698,103.0021232736699,2,establishment|point_of_interest|hospital,"Unnamed Road, Tambon Nong Mek, Amphoe Na Chueak, Chang Wat Maha Sarakham 44170, Thailand"
20,15.754533079476698,103.17033084591685,6,establishment|point_of_interest|hospital,"Unnamed Road, Tambon Dong Duan, Amphoe Na Dun, Chang Wat Maha Sarakham 44170, Thailand"
21,15.754533079476698,103.19836544129134,3,establishment|point_of_interest|hospital,"Unnamed Road, Tambon Dong Duan, Amphoe Na Dun, Chang Wat Maha Sarakham 44180, Thailand"
23,15.754533079476698,103.39460760891279,5,establishment|point_of_interest|hospital,"Unnamed Road, Tambon Pho Chai, Amphoe Wapi Pathum, Chang Wat Maha Sarakham 44120, Thailand"
24,15.72755343210632,102.46946037742089,3,school|establishment|point_of_interest,"Unnamed Road, Tambon Khok Sa-nga, Amphoe Phon, Chang Wat Khon Kaen 40120, Thailand"
31,15.72755343210632,103.00204693436456,1,supermarket|establishment|store|point_of_interest|grocery_or_supermarket|food,"Unnamed Road, Tambon Ban Du, Amphoe Na Pho, Chang Wat Buri Ram 31230, Thailand"
38,15.72755343210632,103.45054087705398,1,school|establishment|point_of_interest,"รอ.3006 Tambon Ban Fang, Amphoe Kaset Wisai, Chang Wat Roi Et 45150, Thailand"
47,15.673594137364933,102.52549613177553,8,establishment|point_of_interest|hospital,"Unnamed Road, Tambon Mueang Phalai, Amphoe Bua Lai, Chang Wat Nakhon Ratchasima 30120, Thailand"
76,15.619634842622684,102.60951838673316,8,school|establishment|point_of_interest,"นม.1013 Tambon Nong Tat Yai, Amphoe Sida, Chang Wat Nakhon Ratchasima 30430, Thailand"
85,15.619634842622684,103.33793562372352,24,establishment|point_of_interest|hospital,"Unnamed Road, Tambon Non Sa-nga, Amphoe Pathum Rat, Chang Wat Roi Et 45190, Thailand"
86,15.619634842622684,103.39396771887664,1,establishment|store|point_of_interest|grocery_or_supermarket|food,"Unnamed Road, Tambon Phon Sung, Amphoe Pathum Rat, Chang Wat Roi Et 45190, Thailand"
98,15.592655195251242,103.42185284470952,1,establishment|store|point_of_interest,"2269, Tambon Non Sawan, Amphoe Pathum Rat, Chang Wat Roi Et 45190, Thailand"
111,15.56567554787959,103.39371349909061,1,establishment|store|point_of_interest|grocery_or_supermarket|food,"Unnamed Road, Tambon Sra Bua, Amphoe Pathum Rat, Chang Wat Roi Et 45190, Thailand"
112,15.56567554787959,103.42172217787368,1,establishment|store|point_of_interest|grocery_or_supermarket|food,"Arun Prasert Rd, Tambon Non Sawan, Amphoe Pathum Rat, Chang Wat Roi Et 45190, Thailand"
132,15.511716253135651,103.39346026958151,5,establishment|point_of_interest|hospital,"Unnamed Road, Tambon Mueang Tao, Amphoe Phayakkhaphum Phisai, Chang Wat Maha Sarakham 44110, Thailand"
139,15.484736605763363,102.91737347597518,9,school|establishment|point_of_interest,"Unnamed Road, Tambon Lahan Pla Khao, Amphoe Mueang Yang, Chang Wat Nakhon Ratchasima 30270, Thailand"
142,15.484736605763363,103.05736187298226,3,school|establishment|point_of_interest,"Unnamed Road, Tambon Ban Yang, Amphoe Phutthaisong, Chang Wat Buri Ram 31120, Thailand"
144,15.484736605763363,103.33733866699617,2,school|establishment|point_of_interest,"Unnamed Road, Tambon Rat Charoen, Amphoe Phayakkhaphum Phisai, Chang Wat Maha Sarakham 44110, Thailand"
146,15.484736605763363,103.47732706400325,1,establishment|store|point_of_interest|clothing_store,"Unnamed Road, Tambon Thung Thong, Amphoe Kaset Wisai, Chang Wat Roi Et 45150, Thailand"
152,15.45775695839087,102.77733942914028,3,school|establishment|point_of_interest,"Unnamed Road, Tambon Khok Klang, Amphoe Prathai, Chang Wat Nakhon Ratchasima 30180, Thailand"
154,15.45775695839087,103.08527372913261,2,school|establishment|point_of_interest,"Unnamed Road, Tambon Ban Yang, Amphoe Phutthaisong, Chang Wat Buri Ram 31120, Thailand"
160,15.45775695839087,103.30922594730885,2,school|establishment|point_of_interest,"Unnamed Road, Tambon Rat Charoen, Amphoe Phayakkhaphum Phisai, Chang Wat Maha Sarakham 44110, Thailand"
161,15.45775695839087,103.36521400185302,1,establishment|point_of_interest|hospital,"Hwy Maha Sarakham 3003, Tambon Mueang Tao, Amphoe Phayakkhaphum Phisai, Chang Wat Maha Sarakham 44110, Thailand"
162,15.45775695839087,103.449196083669,3,school|establishment|point_of_interest,"Unnamed Road, Tambon Thung Thong, Amphoe Kaset Wisai, Chang Wat Roi Et 45150, Thailand"
164,15.430777311018163,102.60935157498409,4,school|establishment|point_of_interest,"Unnamed Road, Tambon Krachon, Amphoe Phimai, Chang Wat Nakhon Ratchasima 30110, Thailand"
165,15.430777311018163,102.637341957285,4,school|establishment|point_of_interest,"Unnamed Road, Tambon Krachon, Amphoe Phimai, Chang Wat Nakhon Ratchasima 30110, Thailand"
179,15.403797663645244,102.60932793095878,2,school|establishment|point_of_interest,"Unnamed Road, Tambon Krachon, Amphoe Phimai, Chang Wat Nakhon Ratchasima 30110, Thailand"
180,15.403797663645244,102.69328816440941,7,school|establishment|point_of_interest,"Unnamed Road, Tambon Krachon, Amphoe Phimai, Chang Wat Nakhon Ratchasima 30270, Thailand"
181,15.403797663645244,102.72127490889295,5,school|establishment|point_of_interest,"Unnamed Road, Tambon Nong Lak, Amphoe Chum Phuang, Chang Wat Nakhon Ratchasima 30270, Thailand"
186,15.403797663645244,103.1970495651127,10,school|establishment|point_of_interest,"Unnamed Road, Tambon Mueang Bua, Amphoe Chumphon Buri, Chang Wat Surin 32190, Thailand"
200,15.349838368898796,102.6092807822888,4,school|establishment|point_of_interest,"Unnamed Road, Tambon Krachon, Amphoe Phimai, Chang Wat Nakhon Ratchasima 30110, Thailand"
201,15.349838368898796,102.63726027258144,6,school|establishment|point_of_interest,"Unnamed Road, Tambon Dong Yai, Amphoe Phimai, Chang Wat Nakhon Ratchasima 30110, Thailand"
212,15.349838368898796,103.50462447164955,3,school|establishment|point_of_interest,"Unnamed Road, Tambon Na Nong Phai, Amphoe Chumphon Buri, Chang Wat Surin 32190, Thailand"
214,15.322858721525252,102.63723315149832,7,school|establishment|point_of_interest,"เลขที่ 116 หมู่ที่ 15 บ้านโนนระเวียง, ตำบลประสุข อำเภอชุมพวง จังหวัดนครราชสีมา, 30270 Thailand"
215,15.322858721525252,102.66520902540856,5,school|establishment|point_of_interest,"Unnamed Road, Tambon Prasuk, Amphoe Chum Phuang, Chang Wat Nakhon Ratchasima 30270, Thailand"
216,15.322858721525252,102.72116077322903,5,school|establishment|point_of_interest,"Unnamed Road, Tambon Prasuk, Amphoe Chum Phuang, Chang Wat Nakhon Ratchasima 30270, Thailand"
224,15.295879074151507,102.80503967191976,1,school|establishment|point_of_interest,"Unnamed Road, Tambon Non Rang, Amphoe Chum Phuang, Chang Wat Nakhon Ratchasima 30270, Thailand"
234,15.268899426777557,102.63717906986108,15,school|establishment|point_of_interest,"Unnamed Road, Tambon Bot, Amphoe Phimai, Chang Wat Nakhon Ratchasima 30110, Thailand"
241,15.268899426777557,103.47623894635922,2,establishment|point_of_interest|hospital,"Unnamed Road, Tambon Krapho, Amphoe Tha Tum, Chang Wat Surin 32120, Thailand"
242,15.268899426777557,103.50420760890916,5,establishment|point_of_interest|hospital,"Unnamed Road, Tambon Krapho, Amphoe Tha Tum, Chang Wat Surin 32120, Thailand"
248,15.241919779403396,102.74901237949518,13,establishment|point_of_interest|hospital,"Moo 10, Tambon Tha Lat, Amphoe Chum Phuang, Nakhon Ratchasima, 30270, Thailand"
249,15.241919779403396,102.80494251462176,3,school|establishment|point_of_interest,"Unnamed Road, Tambon Non Rang, Amphoe Chum Phuang, Chang Wat Nakhon Ratchasima 30270, Thailand"
256,15.241919779403396,103.36424386588749,4,school|establishment|point_of_interest,"Unnamed Road, Tambon Sakae, Amphoe Satuek, Chang Wat Buri Ram 31150, Thailand"
257,15.241919779403396,103.42017400101406,2,school|establishment|point_of_interest,"Unnamed Road, Tambon Thung Wang, Amphoe Satuek, Chang Wat Buri Ram 31150, Thailand"
258,15.241919779403396,103.44813906857735,3,establishment|point_of_interest|hospital,"Unnamed Road, Tambon Krapho, Amphoe Tha Tum, Chang Wat Surin 32120, Thailand"
259,15.241919779403396,103.47610413614063,2,establishment|point_of_interest|hospital,"Unnamed Road, Tambon Krapho, Amphoe Tha Tum, Chang Wat Surin 32120, Thailand"
260,15.241919779403396,103.50406920370392,15,school|establishment|point_of_interest,"สร.3027 Tambon Krapho, Amphoe Tha Tum, Chang Wat Surin 32120, Thailand"
266,15.214940132029035,103.11247035694225,8,establishment|point_of_interest|hospital,"Unnamed Road, Tambon Tum Yai, Amphoe Khu Mueang, Chang Wat Buri Ram 31190, Thailand"
267,15.214940132029035,103.36412367424043,3,school|establishment|point_of_interest,"Unnamed Road, Tambon Sanam Chai, Amphoe Satuek, Chang Wat Buri Ram 31150, Thailand"
270,15.187960484654461,102.72097204510499,2,school|establishment|point_of_interest,"4043, Tambon Sarai, Amphoe Chum Phuang, Chang Wat Nakhon Ratchasima 30270, Thailand"
271,15.187960484654461,102.74892994406014,2,school|establishment|point_of_interest,"Unnamed Road, Tambon Sarai, Amphoe Chum Phuang, Chang Wat Nakhon Ratchasima 30270, Thailand"
272,15.187960484654461,102.80484574197044,1,school|establishment|point_of_interest,"Unnamed Road, Tambon Talat Sai, Amphoe Chum Phuang, Chang Wat Nakhon Ratchasima 30270, Thailand"
273,15.187960484654461,102.88871943883589,2,school|establishment|point_of_interest,"Unnamed Road, Ban Yang, Amphoe Lam Thamenchai, Chang Wat Nakhon Ratchasima 30270, Thailand"
274,15.187960484654461,103.14034052943225,7,establishment|point_of_interest|hospital,"Unnamed Road, Tambon Non Khwang, Amphoe Ban Dan, Chang Wat Buri Ram, Thailand"
275,15.187960484654461,103.19625632734255,4,establishment|point_of_interest|hospital,"219, Tambon Don Mon, Amphoe Satuek, Chang Wat Buri Ram 31150, Thailand"
276,15.187960484654461,103.280130024208,3,school|establishment|point_of_interest,"Unnamed Road, Tambon Ron Thong, Amphoe Satuek, Chang Wat Buri Ram 31150, Thailand"
277,15.187960484654461,103.47583531689406,5,establishment|point_of_interest|hospital,"Unnamed Road, Tambon Mueang Ling, Amphoe Chom Phra, Chang Wat Surin 32180, Thailand"
280,15.16098083727969,102.77684317441776,2,school|establishment|point_of_interest,"Unnamed Road, Tambon Non Tun, Amphoe Chum Phuang, Chang Wat Nakhon Ratchasima 30270, Thailand"
282,15.16098083727969,103.08434075299431,2,school|establishment|point_of_interest,"Unnamed Road, Tambon Hin Lek Fai, Amphoe Khu Mueang, Chang Wat Buri Ram 31190, Thailand"
283,15.16098083727969,103.11229507831945,3,school|establishment|point_of_interest,"Unnamed Road, Tambon Tum Yai, Amphoe Khu Mueang, Chang Wat Buri Ram 31190, Thailand"
284,15.16098083727969,103.22411237962001,2,furniture_store|establishment|home_goods_store|store|point_of_interest,"Unnamed Road, Tambon Ron Thong, Amphoe Satuek, Chang Wat Buri Ram 31150, Thailand"
287,15.16098083727969,103.36388400624571,4,school|establishment|point_of_interest,"Unnamed Road, Tambon Chum Saeng, Amphoe Satuek, Chang Wat Buri Ram 31150, Thailand"
288,15.16098083727969,103.47570130754627,9,establishment|point_of_interest|hospital,"Unnamed Road, Tambon Mueang Ling, Amphoe Chom Phra, Chang Wat Surin 32180, Thailand"
291,15.134001189904708,102.58114328305896,2,school|establishment|point_of_interest,"Unnamed Road, Tambon Lung Takhian, Amphoe Huai Thalaeng, Chang Wat Nakhon Ratchasima 30240, Thailand"
292,15.134001189904708,102.66499555947462,6,school|establishment|point_of_interest,"Unnamed Road, Tambon Lung Takhian, Amphoe Huai Thalaeng, Chang Wat Nakhon Ratchasima 30240, Thailand"
295,15.134001189904708,103.08425694155335,6,school|establishment|point_of_interest,"Unnamed Road, Tambon Thalung Lek, Amphoe Mueang Buri Ram, Chang Wat Buri Ram 31000, Thailand"
296,15.134001189904708,103.14015845916379,1,school|establishment|point_of_interest,"Moo.6, Tambon Ban Dan, Amphoe Ban Dan, Buriram, 31000, Thailand"
297,15.134001189904708,103.27991225318988,12,school|establishment|point_of_interest,"Unnamed Road, Tambon Nong Yai, Amphoe Satuek, Chang Wat Buri Ram 31150, Thailand"
298,15.134001189904708,103.36376452960553,9,establishment|point_of_interest|hospital,"Unnamed Road, Tambon Chum Saeng, Amphoe Satuek, Chang Wat Buri Ram 31150, Thailand"
300,15.107021542529525,102.66496530623192,3,school|establishment|point_of_interest,"Unnamed Road, Tambon Lung Takhian, Amphoe Huai Thalaeng, Chang Wat Nakhon Ratchasima 30240, Thailand"
301,15.107021542529525,102.77675410379732,1,school|establishment|point_of_interest,"Unnamed Road, Tambon Talat Sai, Amphoe Chum Phuang, Chang Wat Nakhon Ratchasima 30270, Thailand"
305,15.107021542529525,103.14006769588457,2,establishment|store|point_of_interest|grocery_or_supermarket|food,"Unnamed Road, Tambon Ban Dan, Amphoe Ban Dan, Chang Wat Buri Ram 31000, Thailand"
306,15.107021542529525,103.16801489527586,23,establishment|point_of_interest|hospital,"DPT., Tambon Ban Dan, Amphoe Ban Dan, Chang Wat Buri Ram 31000, Thailand"
307,15.107021542529525,103.22390929405844,2,school|establishment|point_of_interest,"บ้าน ตลาด, ตำบล ปราสาท อำเภอ บ้านด่าน บุรีรัมย์ 31000, Thailand"
308,15.107021542529525,103.47543408858053,4,school|establishment|point_of_interest,"สร.4026 Tambon Ka Ko, Amphoe Mueang Surin, Chang Wat Surin 32000, Thailand"
309,15.107021542529525,103.50338128797182,1,local_government_office|establishment|point_of_interest,"Unnamed Road, Tambon Ka Ko, Amphoe Mueang Surin, Chang Wat Surin 32000, Thailand"
310,15.080041895154137,102.58110417211469,2,school|establishment|point_of_interest,"Unnamed Road, Tambon Lung Pradu, Amphoe Huai Thalaeng, Chang Wat Nakhon Ratchasima 30240, Thailand"
314,15.080041895154137,103.16792076077456,5,school|establishment|point_of_interest,"219, Tambon Ban Dan, Amphoe Ban Dan, Chang Wat Buri Ram 31000, Thailand"
316,15.080041895154137,103.47530087864402,11,establishment|point_of_interest|hospital,"Unnamed Road, Tambon Phia Ram, Amphoe Mueang Surin, Chang Wat Surin 32000, Thailand"
319,15.053062247778543,102.49726436961362,2,school|establishment|point_of_interest,"Unnamed Road, Tambon Hin Khon, Amphoe Chakkarat, Chang Wat Nakhon Ratchasima 30230, Thailand"
327,15.053062247778543,103.27958722180972,2,establishment|point_of_interest|hospital,"Unnamed Road, Tambon Mueang Pho, Amphoe Huai Rat, Chang Wat Buri Ram 31000, Thailand"
328,15.053062247778543,103.36340752740216,5,establishment|point_of_interest|hospital,"บร.5062 Tambon Huai Samran, Amphoe Krasang, Chang Wat Buri Ram 31160, Thailand"
329,15.026082600402745,102.52519208982358,1,school|establishment|point_of_interest,"Unnamed Road, Tambon Hin Dat, Amphoe Huai Thalaeng, Chang Wat Nakhon Ratchasima 30240, Thailand"
334,15.026082600402745,103.27947931086533,2,pharmacy|health|establishment|store|point_of_interest,"Unnamed Road, Amphoe Huai Rat, Chang Wat Buri Ram, Thailand"
335,15.026082600402745,103.30741587460761,6,school|establishment|point_of_interest,"Unnamed Road, Tambon Si Phum, Amphoe Krasang, Chang Wat Buri Ram 31160, Thailand"
336,15.026082600402745,103.36328900209219,2,establishment|point_of_interest|hospital,"Unnamed Road, Tambon Chum Saeng, Amphoe Krasang, Chang Wat Buri Ram 31160, Thailand"
337,15.026082600402745,103.44709869331905,4,establishment|point_of_interest|hospital,"Unnamed Road, Tambon Na Di, Amphoe Mueang Surin, Chang Wat Surin 32000, Thailand"
338,14.999102953026743,102.46931366756064,1,school|establishment|point_of_interest,"Unnamed Road, Tambon Chakkarat, Amphoe Chakkarat, Chang Wat Nakhon Ratchasima 30230, Thailand"
339,14.999102953026743,102.52517973297915,3,school|establishment|point_of_interest,"Unnamed Road, Tambon Hin Dat, Amphoe Huai Thalaeng, Chang Wat Nakhon Ratchasima 30240, Thailand"
352,14.999102953026743,103.22350555071057,7,school|establishment|point_of_interest,"Unnamed Road, Tambon Khok Lek, Amphoe Huai Rat, Chang Wat Buri Ram 31000, Thailand"
353,14.999102953026743,103.36317071425685,5,establishment|point_of_interest|hospital,"Unnamed Road, Tambon Chum Saeng, Amphoe Krasang, Chang Wat Buri Ram 31160, Thailand"
364,14.945143658274144,102.49722910176752,6,school|establishment|point_of_interest,"Unnamed Road, Tambon Nong Kham, Amphoe Chakkarat, Chang Wat Nakhon Ratchasima 30230, Thailand"
365,14.945143658274144,102.55308108555278,1,school|establishment|point_of_interest,"Unnamed Road, Tambon Sao Dio, Amphoe Nong Hong, Chang Wat Buri Ram 31240, Thailand"
376,14.91816401089754,102.49722032905527,2,school|establishment|point_of_interest,"Unnamed Road, Tambon Khlong Mueang, Amphoe Chakkarat, Chang Wat Nakhon Ratchasima 30230, Thailand"
380,14.91816401089754,102.83229011426135,3,school|establishment|point_of_interest,"Unnamed Road, Tambon Khok Klang, Amphoe Lam Plai Mat, Chang Wat Buri Ram 31130, Thailand"
393,14.891184363520733,102.69264442968438,7,establishment|point_of_interest|hospital,"2166, Tambon Sa Thong, Amphoe Nong Hong, Chang Wat Buri Ram 31240, Thailand"
395,14.891184363520733,102.83223932658609,2,school|establishment|point_of_interest,"Unnamed Road, Tambon Nong Don, Amphoe Lam Plai Mat, Chang Wat Buri Ram 31130, Thailand"
405,14.86420471614373,102.55303380411169,2,establishment|point_of_interest|hospital,"Unnamed Road, Tambon Huai Hin, Amphoe Nong Hong, Chang Wat Buri Ram 31240, Thailand"
406,14.86420471614373,102.72052670647804,3,establishment|point_of_interest|hospital,"Unnamed Road, Tambon Thai Samakkhi, Amphoe Nong Hong, Chang Wat Buri Ram 31240, Thailand"
414,14.837225068766521,102.49719411694844,2,school|establishment|point_of_interest,"Unnamed Road, Tambon Khlong Mueang, Amphoe Chakkarat, Chang Wat Nakhon Ratchasima 30230, Thailand"
416,14.837225068766521,102.77631406833495,2,school|establishment|point_of_interest,"Unnamed Road, Tambon Mueang Fai, Amphoe Nong Hong, Chang Wat Buri Ram 31240, Thailand"
417,14.837225068766521,102.83213805861226,2,school|establishment|point_of_interest,"2073, Tambon Cho Phaka, Amphoe Chamni, Chang Wat Buri Ram 31110, Thailand"
420,14.837225068766521,103.25081798569204,2,establishment|point_of_interest|hospital,"Unnamed Road, Tambon Sung Noen, Amphoe Krasang, Chang Wat Buri Ram 31160, Thailand"
426,14.81024542138912,102.44136838766997,7,school|establishment|point_of_interest,"Unnamed Road, Tambon Saraphi, Amphoe Nong Bunnak, Chang Wat Nakhon Ratchasima 30410, Thailand"
427,14.81024542138912,102.58091095571376,2,school|establishment|point_of_interest,"Unnamed Road, Tambon Khok Sung, Amphoe Nong Ki, Chang Wat Buri Ram 31210, Thailand"
431,14.81024542138912,103.25071528232343,5,establishment|point_of_interest|hospital,"Unnamed Road, Tambon Sung Noen, Amphoe Krasang, Chang Wat Buri Ram 31160, Thailand"
432,14.81024542138912,103.27862379593205,1,school|establishment|point_of_interest,"Unnamed Road, Tambon Sung Noen, Amphoe Krasang, Chang Wat Buri Ram 31160, Thailand"
433,14.81024542138912,103.3065323095409,1,school|establishment|point_of_interest,"Unnamed Road, Tambon Ban Prue, Amphoe Krasang, Chang Wat Buri Ram 31160, Thailand"
435,14.783265774011507,102.52508176959736,2,establishment|point_of_interest|hospital,"Unnamed Road, Tambon Khok Sung, Amphoe Nong Ki, Chang Wat Buri Ram 31210, Thailand"
437,14.783265774011507,102.72041704353524,2,school|establishment|point_of_interest,"Unnamed Road, Tambon Laluat, Amphoe Chamni, Chang Wat Buri Ram 31110, Thailand"
440,14.783265774011507,103.05527751314287,7,establishment|point_of_interest|hospital,"Unnamed Road, Tambon Salaeng Thon, Amphoe Prakhon Chai, Chang Wat Buri Ram 31140, Thailand"
443,14.783265774011507,103.36223294361673,7,establishment|store|point_of_interest|clothing_store,"2 ถนน เทศบาล 2 Tambon Nai Mueang, Amphoe Mueang Surin, Chang Wat Surin 32000, Thailand"
447,14.756286126633706,102.46926649195518,2,school|establishment|point_of_interest,"Unnamed Road, Tambon Thai Charoen, Amphoe Nong Bunnak, Chang Wat Nakhon Ratchasima 30410, Thailand"
448,14.756286126633706,102.49716806366519,1,school|establishment|point_of_interest,"Unnamed Road, Tambon Khok Sawang, Amphoe Nong Ki, Chang Wat Buri Ram 31210, Thailand"
449,14.756286126633706,102.55297120708519,1,bakery|establishment|store|point_of_interest|food,"บร.4019 Tambon Yoei Prasat, Amphoe Nong Ki, Chang Wat Buri Ram 31210, Thailand"
452,14.756286126633706,102.99939635444525,5,establishment|point_of_interest|hospital,"บร.3002 Tambon Si Liam, Amphoe Prakhon Chai, Chang Wat Buri Ram 31140, Thailand"
456,14.756286126633706,103.3621167866753,1,school|establishment|point_of_interest,"หมู่ที่ 7, ตำบลประทัดบุ อำเภอปราสาท จังหวัดสุรินทร์, 32140 Thailand"
458,14.729306479255706,102.44136319181735,2,school|establishment|point_of_interest,"Unnamed Road, Tambon Thai Charoen, Amphoe Nong Bunnak, Chang Wat Nakhon Ratchasima 30410, Thailand"
459,14.729306479255706,102.63664997114665,3,establishment|point_of_interest|hospital,"Unnamed Road, Tambon Tha Pho Chai, Amphoe Nong Ki, Chang Wat Buri Ram 31210, Thailand"
463,14.729306479255706,103.05512164113873,5,school|establishment|point_of_interest,"Unnamed Road, Tambon Ban Sai, Amphoe Prakhon Chai, Chang Wat Buri Ram 31140, Thailand"
466,14.729306479255706,103.30620464313392,3,school|establishment|point_of_interest,"Unnamed Road, Tambon Samut, Amphoe Prasat, Chang Wat Surin 32140, Thailand"
469,14.702326831877503,102.4413614669096,13,school|establishment|point_of_interest,"Unnamed Road, Tambon Nong Bunnak, Amphoe Nong Bunnak, Chang Wat Nakhon Ratchasima 30410, Thailand"
470,14.702326831877503,102.46925612490782,18,school|establishment|point_of_interest,"Unnamed Road, Tambon Bu Krasang, Amphoe Nong Ki, Chang Wat Buri Ram 31210, Thailand"
471,14.702326831877503,102.55294009890247,22,establishment|point_of_interest|hospital,"Unnamed Road, Tambon Thung Kraten, Amphoe Nong Ki, Chang Wat Buri Ram 31210, Thailand"
472,14.702326831877503,102.58083475690069,1,school|establishment|point_of_interest,"Unnamed Road, Tambon Yoei Prasat, Amphoe Nong Ki, Chang Wat Buri Ram 31210, Thailand"
473,14.702326831877503,102.63662407289712,1,electronics_store|establishment|store|point_of_interest,"Unnamed Road, Tha Pho Chai, Nong Ki District, Chang Wat Buri Ram 31110, Thailand"
477,14.702326831877503,102.97135996887562,3,school|establishment|point_of_interest,"Unnamed Road, Tambon Khok Tum, Amphoe Prakhon Chai, Chang Wat Buri Ram 31140, Thailand"
480,14.702326831877503,103.30609586485423,7,establishment|point_of_interest|hospital,"หมู่ 2, ตำบลทุ่งมน อำเภอปราสาท จังหวัดสุรินทร์, 32140 Thailand"
481,14.702326831877503,103.33399052285245,5,establishment|point_of_interest|hospital,"Unnamed Road, Tambon Samut, Amphoe Prasat, Chang Wat Surin 32140, Thailand"
484,14.675347184499106,102.55292459232817,32,establishment|point_of_interest|hospital,"Unnamed Road, Tambon Nong Ki, Amphoe Nong Ki, Chang Wat Buri Ram 31210, Thailand"
485,14.675347184499106,102.6087070157322,7,school|establishment|point_of_interest,"6-6/1 หมู่ 2 ตลาดสดหนองกี่, ต.ทุ่งกระเต็น อ.หนองกี่ จ.บุรีรัมย์, 31210 Thailand"
489,14.675347184499106,102.97129276785813,1,school|establishment|point_of_interest,"Unnamed Road, Tambon Tako Ta Phi, Amphoe Prakhon Chai, Chang Wat Buri Ram 31140, Thailand"
498,14.64836753712051,102.55290911740701,2,establishment|point_of_interest|hospital,"Unnamed Road, Tambon Don A-rang, Amphoe Nong Ki, Chang Wat Buri Ram 31210, Thailand"
499,14.64836753712051,102.60868466228715,1,establishment|store|point_of_interest|grocery_or_supermarket|food,"Unnamed Road, Tambon Nong Bot, Amphoe Nang Rong, Chang Wat Buri Ram 31110, Thailand"
500,14.64836753712051,102.66446020716728,4,establishment|point_of_interest|hospital,"ถนน โชคชัย-เดชอุดม Tambon Hua Thanon, Amphoe Nang Rong, Chang Wat Buri Ram 31110, Thailand"
517,14.621387889741714,103.13846481849464,3,school|establishment|point_of_interest,"Unnamed Road, Tambon Prakhon Chai, Amphoe Prakhon Chai, Chang Wat Buri Ram 31140, Thailand"
522,14.594408242362729,102.49711643244518,9,establishment|point_of_interest|hospital,"Unnamed Road, Tambon Don A-rang, Amphoe Nong Ki, Chang Wat Buri Ram 31210, Thailand"
536,14.567428594983541,102.46923039192154,15,school|establishment|point_of_interest,"2317 Tambon Suk Phai Bun, Amphoe Soeng Sang, Chang Wat Nakhon Ratchasima 30330, Thailand"
537,14.567428594983541,102.52498538555903,11,establishment|point_of_interest|hospital,"43 หมู่ 13, ตำบลดงอีจาน อำเภอโนนสุวรรณ จังหวัดบุรีรัมย์, 31110 Thailand"
542,14.567428594983541,103.13829031557145,4,establishment|point_of_interest|hospital,"Unnamed Road, Tambon Khok Makham, Amphoe Prakhon Chai, Chang Wat Buri Ram 31140, Thailand"
